{
  "type": "object",
  "properties": {
    "id": {
      "type": "string",
      "minLength": 1
    },
    "speaker": {
      "type": "string",
      "minLength": 1
    },
    "recorded_at": {
      "type": "string",
      "minLength": 1
    },
    "question": {
      "type": "string"
    },
    "answer": {
      "type": "string",
      "minLength": 1
    },
    "people": {
      "type": "array",
      "items": {
        "type": "object",
        "properties": {
          "id": {
            "type": "string",
            "minLength": 1
          },
          "label": {
            "type": "string",
            "minLength": 1
          },
          "literal": {
            "type": "string",
            "minLength": 1
          }
        },
        "required": [
          "id",
          "label",
          "literal"
        ],
        "additionalProperties": false
      }
    },
    "assertions": {
      "type": "array",
      "items": {
        "type": "object",
        "properties": {
          "id": {
            "type": "string",
            "minLength": 1
          },
          "subject_id": {
            "type": "string",
            "minLength": 1
          },
          "statement": {
            "type": "string",
            "minLength": 1
          },
          "predicate": {
            "type": "string",
            "minLength": 1
          },
          "value": {},
          "uncertainty": {
            "type": "string",
            "minLength": 1
          },
          "knowledge_basis": {
            "enum": [
              "firsthand",
              "hearsay",
              "inference",
              "unspecified"
            ]
          },
          "object_person_id": {
            "type": "string",
            "minLength": 1
          },
          "supersedes": {
            "type": "array",
            "items": {
              "type": "string",
              "minLength": 1
            }
          }
        },
        "required": [
          "id",
          "subject_id",
          "statement",
          "predicate",
          "value",
          "uncertainty",
          "knowledge_basis"
        ],
        "additionalProperties": false
      }
    },
    "action": {
      "enum": [
        "continue",
        "pause",
        "resume",
        "review",
        "research"
      ]
    },
    "next_action": {
      "type": "string",
      "minLength": 1
    },
    "pending_question": {
      "type": "string"
    },
    "skip_topics": {
      "type": "array",
      "items": {
        "type": "string",
        "minLength": 1
      }
    },
    "focus_person_id": {
      "type": [
        "string",
        "null"
      ]
    },
    "research_question": {
      "type": "string",
      "minLength": 1
    }
  },
  "required": [
    "id",
    "speaker",
    "recorded_at",
    "question",
    "answer",
    "people",
    "assertions",
    "action",
    "next_action"
  ],
  "additionalProperties": false,
  "$schema": "https://json-schema.org/draft/2020-12/schema",
  "title": "Agent-prepared genealogy interview turn"
}
